{
  "protocol_version": 1,
  "authenticated": true,
  "public_id": "8MCR-LXFH",
  "username": "sen11k",
  "ticket": "opaque-disposable-ticket",
  "ticket_expires_at": "2026-10-05T20:46:00Z",
  "game": {
    "slug": "overrun-blitzkrieg",
    "build_id": "01a104ac-a541-78dd-9547-7236bded34fb"
  },
  "join_context": {
    "context_id": "join-context-1",
    "session_id": "21a104ac-a541-48dd-9547-7236bded34fb",
    "invitation_id": "31a104ac-a541-48dd-9547-7236bded34fb",
    "required_build_id": "01a104ac-a541-78dd-9547-7236bded34fb"
  }
}
